{
  "text": "\u00a7 26\u2013901. Businesses required to procure license and pay tax; appointment of resident agent; service of process or notice. | D.C. Law Library Skip to main content Toggle mobile menu Navigation D.C. Law Library Code of the District of Columbia Title 26. Banks and Other Financial Institutions. Chapter 9. Money Lenders; Licenses. \u00a7 26\u2013901. Businesses required to procure license and pay tax; appointment of resident agent; service of process or notice. Code of the District of Columbia \u00a7 26\u2013901. Businesses required to procure license and pay tax; appointment of resident agent; service of process or notice. (a) It shall be unlawful and illegal to engage in the District of Columbia in the business of loaning money upon which a rate of interest greater than 6% per annum is charged on any security of any kind, direct or collateral, tangible or intangible, without procuring license; and all persons, firms, voluntary associations, joint-stock companies, incorporated societies, and corporations engaged in said business shall pay a license tax of $500 per annum to the District of Columbia. No license shall be granted to any person, firm, or voluntary association unless such person and the members of any such firm or voluntary association shall be bona fide residents of the District of Columbia, and no license shall be granted for a period longer than 1 year, and no license shall be granted to any joint-stock company, incorporated society, or corporation unless and until such company, society, or corporation shall, in writing and in due form, to be first approved by and filed with the Mayor of the District of Columbia, appoint an agent, resident in the District of Columbia, upon whom all judicial and other process or legal notice directed to such company, society, or corporation may be served. And in the case of death, removal from the District, or any legal disability or disqualification of any such agent, service of such process or notice may be made upon the Director of the Department of Licenses, Investigation and Inspections of the District of Columbia. (b) Any license issued pursuant to this section shall be issued as a Financial Services endorsement to a basic business license under the basic business license system as set forth in subchapter I-A of Chapter 28 of Title 47 of the District of Columbia Official Code. ( Feb. 4, 1913, 37 Stat. 657, ch. 26, \u00a7 1 ; Mar. 3, 1917, 39 Stat. 1006, ch. 160; Apr. 20, 1999, D.C. Law 12-261, \u00a7 2003(r), 46 DCR 3142 ; Oct. 28, 2003, D.C. Law 15-38, \u00a7 3(q), 50 DCR 6913 .) Prior Codifications 1981 Ed., \u00a7\u200226-701. 1973 Ed., \u00a7\u200226-601. Section References This section is referenced in \u00a7 26-710 and \u00a7 28-3303 . Effect of Amendments D.C. Law 15-38 , in subsec. (b), substituted \u201cFinancial Services endorsement to a basic business license under the basic\u201d for \u201cClass A Financial Services endorsement to a master business license under the master\u201d. Emergency Legislation For temporary (90 day) amendment of section, see \u00a7\u20023(q) of Streamlining Regulation Emergency Act of 2003 (D.C. Act 15-145, August 11, 2003,  50 DCR 6896). Transfer of Functions All functions of the Superintendent of Licenses were transferred to the Director of the Department of Economic Development by Commissioner\u2019s Order No. 69-96, dated March 7, 1969. The Department of Economic Development was replaced by the Department of Licenses, Investigation and Inspection by Mayor\u2019s Order No. 78-42, dated February 17, 1978. The functions of the Department of Licenses, Investigations, and Inspections were transferred to the Department of Consumer and Regulatory Affairs by Reorganization Plan No. 1 of 1983, effective March 31, 1983. Change in Government This section originated at a time when local government powers were delegated to a Board of Commissioners of the District of Columbia (see Acts Relating to the Establishment of the District of Columbia and its Various Forms of Governmental Organization in Volume 1). Section 401 of Reorganization Plan No. 3 of 1967 (see Reorganization Plans in Volume 1) transferred all of the functions of the Board of Commissioners under this section to a single Commissioner. The District of Columbia Self-Government and Governmental Reorganization Act, 87 Stat. 818, \u00a7\u2002711 ( D.C. Code, \u00a7 1-207.11 ), abolished the District of Columbia Council and the Office of Commissioner of the District of Columbia. These branches of government were replaced by the Council of the District of Columbia and the Office of Mayor of the District of Columbia, respectively. Accordingly, and also pursuant to \u00a7\u2002714(a) of such Act ( D.C. Code, \u00a7 1-207.14(a) ), appropriate changes in terminology were made in this section. Previous Chapter 9. Money Lenders; Licenses. Next \u00a7 26\u2013902. Applications for license \u2014 Contents; grant; notice of filing; protest and hearing; power to reject. The codes and laws on this website are in the public domain. Please do not scrape. Instead, bulk download the HTML or XML . Powered by the non-profit Open Law Library . \u00a7 26\u2013902. Applications for license \u2014 Contents; grant; notice of filing; protest and hearing; power to reject. | D.C. Law Library Skip to main content Toggle mobile menu Navigation D.C. Law Library Code of the District of Columbia Title 26. Banks and Other Financial Institutions. Chapter 9. Money Lenders; Licenses. \u00a7 26\u2013902. Applications for license \u2014 Contents; grant; notice of filing; protest and hearing; power to reject. Code of the District of Columbia \u00a7 26\u2013902. Applications for license \u2014 Contents; grant; notice of filing; protest and hearing; power to reject. Applications for license to conduct such business must be made in writing to the Mayor of the District of Columbia, and shall contain the full names and addresses of applicants, if natural persons, and in the case of firms and voluntary associations, the full names and addresses of all the members thereof, and in the case of joint-stock companies, incorporated societies, and corporations, the full names and addresses of the officers and directors thereof and under what law or laws organized or incorporated, and the place where such business is to be conducted, and such other information as the said Mayor may require. Every license granted shall date from the 1st of the month in which it is issued and expire on the 31st day of the following October, and such license shall be kept conspicuously displayed in the place of business of the licensee. Every application shall be filed not less than 30 days prior to the granting of such license, and notice of the filing of such application shall be posted in the office of the Director of the Department of Licenses, Investigation and Inspections of the said District and be published twice a week for 3 successive weeks in a daily newspaper published in the District of Columbia. Protest may be made by any person to the issuing of such license, and when such protests are filed with the said Mayor the latter shall give public notice of and hold a public hearing upon such protests before issuing such license. The said Mayor shall have the power to reject any application for license after a hearing upon such protest or for failure on the part of the applicant to observe this chapter, or when such applicant shall have violated its provisions. ( Feb. 4, 1913, 37 Stat. 657, ch. 26, \u00a7 2 ; Mar. 3, 1917, 39 Stat. 1006, ch. 160.) Prior Codifications 1981 Ed., \u00a7\u200226-702. 1973 Ed., \u00a7\u200226-602. Transfer of Functions All functions of the Superintendent of Licenses were transferred to the Director of the Department of Economic Development by Commissioner\u2019s Order No. 69-96, dated March 7, 1969. The Department of Economic Development was replaced by the Department of Licenses, Investigation and Inspection by Mayor\u2019s Order No. 78-42, dated February 17, 1978. Change in Government This section originated at a time when local government powers were delegated to a Board of Commissioners of the District of Columbia (see Acts Relating to the Establishment of the District of Columbia and its Various Forms of Government Organization in Volume 1). Section 401 of Reorganization Plan No. 3 of 1967 (see Reorganization Plans in Volume 1) transferred all of the functions of the Board of Commissioners under this section to a single Commissioner. The District of Columbia Self-Government and Governmental Reorganization Act. 87 Stat. 818, \u00a7\u2002711 ( D.C. Code, \u00a7 1-207.11 ), abolished the District of Columbia Council and the Office of Commissioner of the District of Columbia. These branches of government were replaced by the Council of the District of Columbia and the Office of Mayor of the District of Columbia, respectively. Accordingly, and also pursuant to \u00a7\u2002714(a) of such Act ( D.C. Code, \u00a7 1-207.14(a) ), appropriate changes in terminology were made in this section. Previous \u00a7 26\u2013901. Businesses required to procure license and pay tax; appointment of resident agent; service of process or notice. Next \u00a7 26\u2013903. Applications for license \u2014 Bond; actions thereon; use of certified copy; renewal and refiling. The codes and laws on this website are in the public domain. Please do not scrape. Instead, bulk download the HTML or XML . Powered by the non-profit Open Law Library . \u00a7 26\u2013903. Applications for license \u2014 Bond; actions thereon; use of certified copy; renewal and refiling. | D.C. Law Library Skip to main content Toggle mobile menu Navigation D.C. Law Library Code of the District of Columbia Title 26. Banks and Other Financial Institutions. Chapter 9. Money Lenders; Licenses. \u00a7 26\u2013903. Applications for license \u2014 Bond; actions thereon; use of certified copy; renewal and refiling. Code of the District of Columbia \u00a7 26\u2013903. Applications for license \u2014 Bond; actions thereon; use of certified copy; renewal and refiling. Each application shall be accompanied by a bond to the District of Columbia in the penal sum of $5,000, with 2 or more sufficient sureties, and conditioned that the obligor will not violate any law relating to such business. The execution of any such bond by a fidelity or surety company authorized by the laws of the United States to transact business therein shall be equivalent to the execution thereof by 2 sureties, and such company, if excepted to, shall justify in the manner required by law of fidelity and surety companies. If any person shall be aggrieved by the misconduct of any such licensed person, firm, voluntary association, joint-stock company, incorporated society, or corporation, or by his, their, or its violation of any law relating to such business, and shall recover a judgment therefor, such person or his personal representative or heirs or distributees may, after a return unsatisfied either in whole or in part of any execution issued upon such judgment, maintain an action in his own name upon such bond herein required in any court having jurisdiction of the amount claimed. The Mayor of the District of Columbia shall furnish to anyone applying therefor a certified copy of any such bond filed with him, upon the payment of a fee of $.25, and such certified copy shall be prima facie evidence in any court that such bond was duly executed and delivered by the person, firm, voluntary association, joint-stock company, incorporated society, or corporation whose names appear thereon. Said bond shall be renewed and refiled annually in October of each year, or the licensed person, firm, voluntary association, joint-stock company, incorporated society, or corporation shall within 30 days thereafter, cease doing business, and their license shall be revoked by the said Mayor, but said bond until renewed and refiled as aforesaid shall be and remain in full force and effect. The Mayor may waive the bonding requirements of this section, if alternative surety arrangements are secured, in cases involving parties specified in \u00a7 26-910 . ( Feb. 4, 1913, 37 Stat. 658, ch. 26, \u00a7 3 ; Apr. 9, 1997, D.C. Law 11-171, \u00a7 2(a), 43 DCR 4484 .) Prior Codifications 1981 Ed., \u00a7\u200226-703. 1973 Ed., \u00a7\u200226-603. Emergency Legislation For temporary amendment of section, see \u00a7\u20022(a) of the Community Development Corporations Money Lender License Tax Exemption Congressional Recess Emergency Amendment Act of 1996 (D.C. Act 11-399, October 9, 1996,  43 DCR 5695), \u00a7\u20022(a) of the Community Development Corporations Money Lender License Tax Exemption Congressional Review Emergency Amendment Act of 1996 (D.C. Act 11-473, December 30, 1996,  44 DCR 195), and \u00a7\u20022(a) of the Community Development Corporations Money Lender License Tax Exemption Congressional Review Emergency Amendment Act of 1997 (D.C. Act 12-54, March 31, 1997,  44 DCR 2216). Change in Government This section originated at a time when local government powers were delegated to a Board of Commissioners of the District of Columbia (see Acts Relating to the Establishment of the District of Columbia and its Various Forms of Governmental Organization in Volume 1). Section 401 of Reorganization Plan No. 3 of 1967 (see Reorganization Plans in Volume 1) transferred all of the functions of the Board of Commissioners under this section to a single Commissioner. The District of Columbia Self-Government and Governmental Reorganization Act, 87 Stat. 818, \u00a7\u2002711 ( D.C. Code, \u00a7 1-207.11 ), abolished the District of Columbia Council and the Office of Commissioner of the District of Columbia. These branches of government were replaced by the Council of the District of Columbia and the Office of Mayor of the District of Columbia, respectively. Accordingly, and also pursuant to \u00a7\u2002714(a) of such Act ( D.C. Code, \u00a7 1-207.14(a) ), appropriate changes in terminology were made in this section. Previous \u00a7 26\u2013902. Applications for license \u2014 Contents; grant; notice of filing; protest and hearing; power to reject. Next \u00a7 26\u2013904. Register to be kept; contents; inspection; annual statements. The codes and laws on this website are in the public domain. Please do not scrape. Instead, bulk download the HTML or XML . Powered by the non-profit Open Law Library . \u00a7 26\u2013904. Register to be kept; contents; inspection; annual statements. | D.C. Law Library Skip to main content Toggle mobile menu Navigation D.C. Law Library Code of the District of Columbia Title 26. Banks and Other Financial Institutions. Chapter 9. Money Lenders; Licenses. \u00a7 26\u2013904. Register to be kept; contents; inspection; annual statements. Code of the District of Columbia \u00a7 26\u2013904. Register to be kept; contents; inspection; annual statements. Every person, firm, voluntary association, joint-stock company, incorporated society, or corporation conducting such business shall keep a register, approved by said Mayor, showing in English, the amount of money loaned, the date when loaned and when due, the person to whom loaned, the property or thing named as security for the loan, where the same is located and in whose possession, the amount of interest, all fees, commissions, charges, and renewals charged, under whatever name. Such register shall be open for inspection to the said Mayor, his officers and agents, on every day, except Sundays and legal holidays, between the hours of 9:00 in the forenoon and 5:00 in the afternoon. Every such person, firm, voluntary association, joint-stock company, incorporated society, or corporation conducting such business shall, on or before the 20th day of January of each year, make to the said Mayor an annual statement in the form of a trial balance of its books on the 31st day of December in each year, specifying the different kinds of its liabilities and the different kinds of its assets, stating the amount of each, together with such other information as may be called for. ( Feb. 4, 1913, 37 Stat. 658, ch. 26, \u00a7 4 .) Prior Codifications 1981 Ed., \u00a7\u200226-704. 1973 Ed., \u00a7\u200226-604. Change in Government This section originated at a time when local government powers were delegated to a Board of Commissioners of the District of Columbia (see Acts Relating to the Establishment of the District of Columbia and its Various Forms of Governmental Organization in Volume 1). Section 401 of Reorganization Plan No. 3 of 1967 (see Reorganization Plans in Volume 1) transferred all of the functions of the Board of Commissioners under this section to a single Commissioner. The District of Columbia Self-Government and Governmental Reorganization Act, 87 Stat. 818, \u00a7\u2002711 ( D.C. Code, \u00a7 1-207.11 ), abolished the District of Columbia Council and the Office of Commissioner of the District of Columbia. These branches of government were replaced by the Council of the District of Columbia and the Office of Mayor of the District of Columbia, respectively. Accordingly, and also pursuant to \u00a7\u2002714(a) of such Act ( D.C. Code, \u00a7 1-207.14(a) ), appropriate changes in terminology were made in this section. Previous \u00a7 26\u2013903. Applications for license \u2014 Bond; actions thereon; use of certified copy; renewal and refiling. Next \u00a7 26\u2013905. Maximum rate of interest; fees and charges covered; deduction from principal prohibited; statement and receipts furnished borrower; amount of loans; violations. The codes and laws on this website are in the public domain. Please do not scrape. Instead, bulk download the HTML or XML . Powered by the non-profit Open Law Library . \u00a7 26\u2013905. Maximum rate of interest; fees and charges covered; deduction from principal prohibited; statement and receipts furnished borrower; amount of loans; violations. | D.C. Law Library Skip to main content Toggle mobile menu Navigation D.C. Law Library Code of the District of Columbia Title 26. Banks and Other Financial Institutions. Chapter 9. Money Lenders; Licenses. \u00a7 26\u2013905. Maximum rate of interest; fees and charges covered; deduction from principal prohibited; statement and receipts furnished borrower; amount of loans; violations. Code of the District of Columbia \u00a7 26\u2013905. Maximum rate of interest; fees and charges covered; deduction from principal prohibited; statement and receipts furnished borrower; amount of loans; violations. No such person, firm, voluntary association, joint-stock company, incorporated society, or corporation shall charge or receive a greater rate of interest upon any loan made by him or it that exceeds the lawful rate in the District of Columbia set by Chapter 33 of Title 28 on the actual amount of the loan, and this charge shall cover all fees, expenses, demands, and services of every character, including notarial and recording fees and charges, except upon the foreclosure of the security. The foregoing interest shall not be deducted from the principal of loan when same is made. Every such person, firm, voluntary association, joint-stock company, incorporated society, or corporation conducting such business shall furnish the borrower a written, typewritten, or printed statement at the time the loan is made, showing, in English, in clear and distinct terms, the amount of the loan, the date when loaned and when due, the person to whom the loan is made, the name of the lender, the amount of interest charged, and the lender shall give the borrower a plain and complete receipt for all payments made on account of the loan at the time such payments are made. No such loan greater than $200 shall be made to any 1 person; provided, that any person contracting, directly or indirectly, for, or receiving a greater rate of interest than that fixed in this chapter, shall forfeit all interest so contracted for or received; and in addition thereto shall forfeit to the borrower a sum of money, to be deducted from the amount due for principal, equal to one-fourth of the principal sum; and provided further, that any person in the employ of the government who shall loan money in violation of the provisions of this chapter shall forfeit his office or position, and be removed from the same. ( Feb. 4, 1913, 37 Stat. 659, ch. 26, \u00a7 5 ; Feb. 24, 1987, D.C. Law 6-188, \u00a7 2(a), 33 DCR 7687 .) Prior Codifications 1981 Ed., \u00a7\u200226-705. 1973 Ed., \u00a7\u200226-605. Previous \u00a7 26\u2013904. Register to be kept; contents; inspection; annual statements. Next \u00a7 26\u2013906. Complaints; investigation; suspension, revocation, or denial of license. The codes and laws on this website are in the public domain. Please do not scrape. Instead, bulk download the HTML or XML . Powered by the non-profit Open Law Library . \u00a7 26\u2013906. Complaints; investigation; suspension, revocation, or denial of license. | D.C. Law Library Skip to main content Toggle mobile menu Navigation D.C. Law Library Code of the District of Columbia Title 26. Banks and Other Financial Institutions. Chapter 9. Money Lenders; Licenses. \u00a7 26\u2013906. Complaints; investigation; suspension, revocation, or denial of license. Code of the District of Columbia \u00a7 26\u2013906. Complaints; investigation; suspension, revocation, or denial of license. Any complaint against a licensee or applicant shall be made in writing to the Mayor and the Mayor, on the basis of a written complaint or his or her initiative, may conduct an investigation. Pursuant to the investigation, the Mayor may suspend, revoke, or deny a license to any applicant or licensee who violates the provisions of this chapter. Before suspending, revoking, or denying a license, the Mayor shall notify the applicant or licensee of his or her right to a hearing pursuant to \u00a7 2-509 . ( Feb. 4, 1913, 37 Stat. 659, ch. 26, \u00a7 6 ; Feb. 24, 1987, D.C. Law 6-188, \u00a7 2(b), 33 DCR 7687 .) Prior Codifications 1981 Ed., \u00a7\u200226-706. 1973 Ed., \u00a7\u200226-606. Previous \u00a7 26\u2013905. Maximum rate of interest; fees and charges covered; deduction from principal prohibited; statement and receipts furnished borrower; amount of loans; violations. Next \u00a7 26\u2013907. Violations. The codes and laws on this website are in the public domain. Please do not scrape. Instead, bulk download the HTML or XML . Powered by the non-profit Open Law Library . \u00a7 26\u2013907. Violations. | D.C. Law Library Skip to main content Toggle mobile menu Navigation D.C. Law Library Code of the District of Columbia Title 26. Banks and Other Financial Institutions. Chapter 9. Money Lenders; Licenses. \u00a7 26\u2013907. Violations. Code of the District of Columbia \u00a7 26\u2013907. Violations. (a) A person violating any provision of this chapter shall, upon conviction, be fined $300, imprisoned for not less than 30 days or more than 90 days, or both. In addition, the court may order any person violating this chapter to make restitution for the value of property illegally obtained as a result of the violation. Prosecutions for violations of this chapter or any rules issued pursuant to this chapter shall be conducted in the Superior Court of the District of Columbia by the Corporation Counsel or any of his or her assistants in the name of the District of Columbia. (b) Civil fines, penalties, and fees may be imposed as alternative sanctions for any infraction of the provisions of this chapter, or any rules or regulations issued under the authority of this chapter, pursuant to Chapter 18 of Title 2 . Adjudication of any infraction of this chapter shall be pursuant to Chapter 18 of Title 2 . ( Feb. 4, 1913, 37 Stat. 659, ch. 26, \u00a7 7 ; Oct. 5, 1985, D.C. Law 6-42, \u00a7 466, 32 DCR 4450 ; Feb. 24, 1987, D.C. Law 6-188, \u00a7 2(c), 33 DCR 7687 ; Mar. 8, 1991, D.C. Law 8-237, \u00a7 5, 38 DCR 314 .) Prior Codifications 1981 Ed., \u00a7\u200226-707. 1973 Ed., \u00a7\u200226-607. Previous \u00a7 26\u2013906. Complaints; investigation; suspension, revocation, or denial of license. Next \u00a7 26\u2013908. Fees allowed on foreclosure. The codes and laws on this website are in the public domain. Please do not scrape. Instead, bulk download the HTML or XML . Powered by the non-profit Open Law Library . \u00a7 26\u2013908. Fees allowed on foreclosure. | D.C. Law Library Skip to main content Toggle mobile menu Navigation D.C. Law Library Code of the District of Columbia Title 26. Banks and Other Financial Institutions. Chapter 9. Money Lenders; Licenses. \u00a7 26\u2013908. Fees allowed on foreclosure. Code of the District of Columbia \u00a7 26\u2013908. Fees allowed on foreclosure. In any foreclosure on any loan made under this chapter no charges for attorneys\u2019 or agents\u2019 fees shall be made or collected which will exceed 10% of the amount found due in such foreclosure proceedings. ( Feb. 4, 1913, 37 Stat. 660, ch. 26, \u00a7 8 .) Prior Codifications 1981 Ed., \u00a7\u200226-708. 1973 Ed., \u00a7\u200226-608. Previous \u00a7 26\u2013907. Violations. Next \u00a7 26\u2013909. Penalty provisions in contracts prohibited. The codes and laws on this website are in the public domain. Please do not scrape. Instead, bulk download the HTML or XML . Powered by the non-profit Open Law Library . \u00a7 26\u2013909. Penalty provisions in contracts prohibited. | D.C. Law Library Skip to main content Toggle mobile menu Navigation D.C. Law Library Code of the District of Columbia Title 26. Banks and Other Financial Institutions. Chapter 9. Money Lenders; Licenses. \u00a7 26\u2013909. Penalty provisions in contracts prohibited. Code of the District of Columbia \u00a7 26\u2013909. Penalty provisions in contracts prohibited. In any contract made in pursuance of the provisions of this chapter it shall be unlawful to incorporate any provision for liquidated or other damages as a penalty for any default or forfeiture thereunder. ( Feb. 4, 1913, 37 Stat. 660, ch. 26, \u00a7 9 .) Prior Codifications 1981 Ed., \u00a7\u200226-709. 1973 Ed., \u00a7\u200226-609. Previous \u00a7 26\u2013908. Fees allowed on foreclosure. Next \u00a7 26\u2013910. Exemption of certain persons and businesses; service of process thereupon. The codes and laws on this website are in the public domain. Please do not scrape. Instead, bulk download the HTML or XML . Powered by the non-profit Open Law Library . \u00a7 26\u2013910. Exemption of certain persons and businesses; service of process thereupon. | D.C. Law Library Skip to main content Toggle mobile menu Navigation D.C. Law Library Code of the District of Columbia Title 26. Banks and Other Financial Institutions. Chapter 9. Money Lenders; Licenses. \u00a7 26\u2013910. Exemption of certain persons and businesses; service of process thereupon. Code of the District of Columbia \u00a7 26\u2013910. Exemption of certain persons and businesses; service of process thereupon. (a) Nothing contained in this chapter shall be held to apply to the legitimate business of national banks, licensed bankers, licensed mortgage brokers, licensed mortgage lenders, any person exempt from licensure under \u00a7 26-1102 if the activity involves making or brokering a mortgage, trust companies, savings banks, building and loan associations, small business investment companies licensed and operating under the Small Business Investment Act of 1958, or to life insurance companies. As used in this section the term \u201clife insurance companies\u201d means and includes any life insurance company authorized to do business in the District of Columbia pursuant to Chapters 42 to 47 of Title 31 and any other life insurance company which has a valid, current license to do business as such in any state of the United States. (b) Any person or any legal entity exempted from the provisions of this chapter by such subsection (a) of this section making loans secured on real or personal property in the District of Columbia who or which does not maintain an office for doing business in the District of Columbia or a residence in said District where such person or legal entity may be served with process in any suit arising out of any such transaction or in connection with such property shall appoint and maintain at all times in the District of Columbia a resident agent upon whom process may be served in any such suit, and shall register with the Mayor of the District of Columbia or with his designee the name and address of such resident agent. Any such person or legal entity which fails to appoint and maintain at all times in the District of Columbia such resident agent shall not, while such failure continues, be entitled to the exemption provided in this section. Whenever any such person or entity does not have in the District of Columbia an agent for service of process or such agent cannot with reasonable diligence be found at his registered address, then the said Mayor or his designee shall be the agent for the service of process for such person or entity. Service of process on the Mayor or his designee shall be made by delivering to, and leaving with him, or with any person having charge of his office, or with his designee, duplicate copies of the process accompanied by a fee in the amount of $2 and such service shall be sufficient service upon such person or entity. In the event of such service, the Mayor, or his designee, shall immediately cause one of such copies to be forwarded by registered or certified mail, addressed to such person or entity at his or its address, as such address appears on the records of the Mayor or his designee. Any such service shall be returnable in not less than 30 days unless the rules of the court issuing such process prescribe another period, in which case such prescribed period shall govern. Nothing contained in this section shall limit or affect the right to serve any process, notice, or demand required or permitted by law to be served on any such person or entity in any other manner now or hereafter permitted by law. (c) For the purposes of this section, the term: (1) \u201cCommunity Development Corporation\u201d or \u201cCDC\u201d means any community development corporation recognized by, and under contract with, the District of Columbia Department of Housing and Community Development (or any successor agency) that is engaged in business and economic development activities in the form of making microloans through the use of funds loaned to them by nationally or locally chartered banks or financial institutions for the specific purpose of microlending, and which organization is organized under Chapter 4 of Title 29 , and whose articles of incorporation and bylaws are consistent with rules and regulations issued by the Mayor of the District of Columbia pursuant to subchapter IV [repealed] of Chapter 12 of Title 2 . (2) \u201cMicroloans\u201d or \u201cmicrolending\u201d means a CDC engaging in the practice of making or issuing any loans up to, and including, $25,000 to any person engaged in business within the District of Columbia. (3) \u201cPerson\u201d means any natural person, partnership, limited partnership, or corporation, including corporations taxed under Subchapter S of the Internal Revenue Code. (d) No money lender license tax contained in this chapter shall be held to apply to a CDC engaged in microlending where the funds used for the microlending program were loaned to the CDC by a nationally or locally chartered bank or financial institution for the specific purpose of microlending, provided that the CDC operates and makes loans only in the geographical service area defined in their agreements with the District of Columbia Department of Housing and Community Development. ( Feb. 4, 1913, 37 Stat. 660, ch. 26, \u00a7 10 ; June 11, 1960, 74 Stat. 196, Pub. L. 86-502, \u00a7 7 ; Dec. 5, 1963, 77 Stat. 344, Pub. L. 88-191, \u00a7 1 ; Feb. 24, 1987, D.C. Law 6-188, \u00a7 2(d), 33 DCR 7687 ; Sept. 9, 1996, D.C. Law 11-155, \u00a7 23(a), 43 DCR 4213 ; Apr. 9, 1997, D.C. Law 11-171, \u00a7 2(b), 43 DCR 4484 ; June 6, 1998, D.C. Law 12-116, \u00a7 4, 45 DCR 1959 ; July 2, 2011, D.C. Law 18-378, \u00a7 3(h), 58 DCR 1720 .) Prior Codifications 1981 Ed., \u00a7\u200226-710. 1973 Ed., \u00a7\u200226-610. Section References This section is referenced in \u00a7 26-903 . Effect of Amendments D.C. Law 18-378 , in subsec. (c)(1), substituted \u201c Chapter 4 of Title 29 \u201d for \u201c subchapter I of Chapter 3 of Title 29 \u201d. Emergency Legislation For temporary amendment of section, see \u00a7\u20022 of the Community Development Corporations Money Lender License Exemption Emergency Amendment Act of 1995 (D.C. Act 11-145, October 23, 1995,  42 DCR 6046) and \u00a7\u20022 of the Community Development Corporations Money Lender Licensing Fee and Bonding Exemption Legislative Review Emergency Amendment Act of 1996 (D.C. Act 11-184, January 23, 1996,  43 DCR 378). For temporary amendment of section, see \u00a7\u20022(b) of the Community Development Corporations Money Lender License Tax Exemption Congressional Recess Emergency Amendment Act of 1996 (D.C. Act 11-399, October 9, 1996,  43 DCR 5695), \u00a7\u20022(b) of the Community Development Corporations Money Lender License Tax Exemption Congressional Review Emergency Amendment Act of 1996 (D.C. Act 11-473, December 30, 1996,  44 DCR 195), and \u00a7\u20022(b) of the Community Development Corporations Money Lender License Tax Exemption Congressional Review Emergency Amendment Act of 1997 (D.C. Act 12-54, March 31, 1997,  44 DCR 2216). For temporary amendment of section, see \u00a7\u20024 of the Mortgage Lender and Broker Act of 1996 Emergency Amendment Act of 1997 (D.C. Act 12-23, March 3, 1997,  44 DCR 1773), \u00a7\u20024 of the Mortgage Lender and Broker Act of 1996 Emergency Amendment Act of 1997 (D.C. Act 12-245, January 13, 1998,  45 DCR 656), and \u00a7\u20024 of the Mortgage Lender and Broker Act of 1996 Congressional Review Emergency Amendment Act of 1998 (D.C. Act 12-308, March 20, 1998,  45 DCR 1920). Temporary Legislation Section 4 of D.C. Law 12-3 inserted \u201cany person exempt from licensure under \u00a7\u200226-1002 1981 Ed. if the activity involves making or brokering a mortgage\u201d in the first sentence in (a). Section 6(b) of D.C. Law 12-3 provided that the act shall expire after 225 days of its having taken effect. Section 4 of D.C. Law 12-101 inserted \u201cany person exempt from licensure under \u00a7\u200226-1002 1981 Ed. if the activity involves making or brokering a mortgage\u201d in the first sentence in (a). Section 6(b) of D.C. Law 12-101 provided that the act shall expire after 225 days of its having taken effect. References in Text The Small Business Investment Act of 1958, referred to in the first sentence of subsection (a) of this section, is the Act of August 21, 1958, 72 Stat. 689, Pub. L. 85-699 and is codified in various sections of Titles 12, 15, and 18 of the United States Code. Change in Government This section originated at a time when local government powers were delegated to a Board of Commissioners of the District of Columbia (see Acts Relating to the Establishment of the District of Columbia and its Various Forms of Governmental Organization in Volume 1). Section 401 of Reorganization Plan No. 3 of 1967 (see Reorganization Plans in Volume 1) transferred all of the functions of the Board of Commissioners under this section to a single Commissioner. The District of Columbia Self-Government and Governmental Reorganization Act, 87 Stat. 818, \u00a7\u2002711 ( D.C. Code, \u00a7 1-207.11 ), abolished the District of Columbia Council and the Office of Commissioner of the District of Columbia. These branches of government were replaced by the Council of the District of Columbia and the Office of Mayor of the District of Columbia, respectively. Accordingly, and also pursuant to \u00a7\u2002714(a) of such Act ( D.C. Code, \u00a7 1-207.14(a) ), appropriate changes in terminology were made in this section. Previous \u00a7 26\u2013909. Penalty provisions in contracts prohibited. Next \u00a7 26\u2013911. Enforcement; rules and regulations. The codes and laws on this website are in the public domain. Please do not scrape. Instead, bulk download the HTML or XML . Powered by the non-profit Open Law Library . \u00a7 26\u2013911. Enforcement; rules and regulations. | D.C. Law Library Skip to main content Toggle mobile menu Navigation D.C. Law Library Code of the District of Columbia Title 26. Banks and Other Financial Institutions. Chapter 9. Money Lenders; Licenses. \u00a7 26\u2013911. Enforcement; rules and regulations. Code of the District of Columbia \u00a7 26\u2013911. Enforcement; rules and regulations. The enforcement of this chapter shall be intrusted to the Mayor of the District of Columbia, and the Council of the District of Columbia is hereby authorized and empowered to make all rules and regulations necessary in its judgment for the conduct of such business and the enforcement of this chapter in addition hereto and not inconsistent herewith. ( Feb. 4, 1913, 37 Stat. 660, ch. 26, \u00a7 11 .) Prior Codifications 1981 Ed., \u00a7\u200226-711. 1973 Ed., \u00a7\u200226-611. Change in Government This section originated at a time when local government powers were delegated to a Board of Commissioners of the District of Columbia (see Acts Relating to the Establishment of the District of Columbia and its Various Forms of Governmental Organization in Volume 1). Section 402(224) of Reorganization Plan No. 3 of 1967 (see Reorganization Plans in Volume 1) transferred all of the functions of the Board of Commissioners under this section to the District of Columbia Council, subject to the right of the Commissioner as provided in \u00a7\u2002406 of the Plan. The District of Columbia Self-Government and Governmental Reorganization Act, 87 Stat. 818, \u00a7\u2002711 ( D.C. Code, \u00a7 1-207.11 ), abolished the District of Columbia Council and the Office of Commissioner of the District of Columbia. These branches of government were replaced by the Council of the District of Columbia and the Office of Mayor of the District of Columbia, respectively. Accordingly, and also pursuant to \u00a7\u2002714(a) of such Act ( D.C. Code, \u00a7 1-207.14(a) ), appropriate changes in terminology were made in this section. Previous \u00a7 26\u2013910. Exemption of certain persons and businesses; service of process thereupon. Next \u00a7 26\u2013912. Exemption of certain loans; severability. The codes and laws on this website are in the public domain. Please do not scrape. Instead, bulk download the HTML or XML . Powered by the non-profit Open Law Library . \u00a7 26\u2013912. Exemption of certain loans; severability. | D.C. Law Library Skip to main content Toggle mobile menu Navigation D.C. Law Library Code of the District of Columbia Title 26. Banks and Other Financial Institutions. Chapter 9. Money Lenders; Licenses. \u00a7 26\u2013912. Exemption of certain loans; severability. Code of the District of Columbia \u00a7 26\u2013912. Exemption of certain loans; severability. (a) No provision of this chapter shall apply with respect to any loan, or to the making of any loan: (1) To any corporation which is unable to plead any statutes against usury in any action; (2) Repealed; (3) Secured on real estate located outside of the District of Columbia; (4) To a borrower residing, doing business, or incorporated outside of the District of Columbia; or (5) Greater than $25,000. (b) If any provision of this section or the application thereof to any person or circumstance, is held invalid, the remainder of the section, and the application of such provision to other persons or circumstances shall not be affected thereby. ( Feb. 4, 1913, ch. 26, \u00a7 14 ; Dec. 17, 1971, 85 Stat. 679, Pub. L. 92-200, \u00a7 9(a) ; Feb. 24, 1987, D.C. Law 6-188, \u00a7 2(e), (f), 33 DCR 7687 .) Prior Codifications 1981 Ed., \u00a7\u200226-712. 1973 Ed., \u00a7\u200226-612. Previous \u00a7 26\u2013911. Enforcement; rules and regulations. Next Chapter 10. Money Transmissions. The codes and laws on this website are in the public domain. Please do not scrape. Instead, bulk download the HTML or XML . Powered by the non-profit Open Law Library .",
  "metadata": {
    "site_url": "https://code.dccouncil.gov/us/dc/council/code/titles/26/chapters/9",
    "extra_data": {
      "code_title": "Title 26: Banks and Other Financial Institutions",
      "chapter_number": "9",
      "separated_text": {
        "\u00a7 26\u2013901. Businesses required to procure license and pay tax; appointment of resident agent; service of process or notice.": "(a) It shall be unlawful and illegal to engage in the District of Columbia in the business of loaning money upon which a rate of interest greater than 6% per annum is charged on any security of any kind, direct or collateral, tangible or intangible, without procuring license; and all persons, firms, voluntary associations, joint-stock companies, incorporated societies, and corporations engaged in said business shall pay a license tax of $500 per annum to the District of Columbia. No license shall be granted to any person, firm, or voluntary association unless such person and the members of any such firm or voluntary association shall be bona fide residents of the District of Columbia, and no license shall be granted for a period longer than 1 year, and no license shall be granted to any joint-stock company, incorporated society, or corporation unless and until such company, society, or corporation shall, in writing and in due form, to be first approved by and filed with the Mayor of the District of Columbia, appoint an agent, resident in the District of Columbia, upon whom all judicial and other process or legal notice directed to such company, society, or corporation may be served. And in the case of death, removal from the District, or any legal disability or disqualification of any such agent, service of such process or notice may be made upon the Director of the Department of Licenses, Investigation and Inspections of the District of Columbia.",
        "Prior Codifications": "1981 Ed., \u00a7\u200226-712.",
        "Section References": "This section is referenced in \u00a7 26-903 .",
        "Effect of Amendments": "D.C. Law 18-378 , in subsec. (c)(1), substituted \u201c Chapter 4 of Title 29 \u201d for \u201c subchapter I of Chapter 3 of Title 29 \u201d.",
        "Emergency Legislation": "For temporary amendment of section, see \u00a7\u20022 of the Community Development Corporations Money Lender License Exemption Emergency Amendment Act of 1995 (D.C. Act 11-145, October 23, 1995,  42 DCR 6046) and \u00a7\u20022 of the Community Development Corporations Money Lender Licensing Fee and Bonding Exemption Legislative Review Emergency Amendment Act of 1996 (D.C. Act 11-184, January 23, 1996,  43 DCR 378).",
        "Transfer of Functions": "All functions of the Superintendent of Licenses were transferred to the Director of the Department of Economic Development by Commissioner\u2019s Order No. 69-96, dated March 7, 1969. The Department of Economic Development was replaced by the Department of Licenses, Investigation and Inspection by Mayor\u2019s Order No. 78-42, dated February 17, 1978.",
        "Change in Government": "This section originated at a time when local government powers were delegated to a Board of Commissioners of the District of Columbia (see Acts Relating to the Establishment of the District of Columbia and its Various Forms of Governmental Organization in Volume 1). Section 402(224) of Reorganization Plan No. 3 of 1967 (see Reorganization Plans in Volume 1) transferred all of the functions of the Board of Commissioners under this section to the District of Columbia Council, subject to the right of the Commissioner as provided in \u00a7\u2002406 of the Plan. The District of Columbia Self-Government and Governmental Reorganization Act, 87 Stat. 818, \u00a7\u2002711 ( D.C. Code, \u00a7 1-207.11 ), abolished the District of Columbia Council and the Office of Commissioner of the District of Columbia. These branches of government were replaced by the Council of the District of Columbia and the Office of Mayor of the District of Columbia, respectively. Accordingly, and also pursuant to \u00a7\u2002714(a) of such Act ( D.C. Code, \u00a7 1-207.14(a) ), appropriate changes in terminology were made in this section.",
        "\u00a7 26\u2013902. Applications for license \u2014 Contents; grant; notice of filing; protest and hearing; power to reject.": "Applications for license to conduct such business must be made in writing to the Mayor of the District of Columbia, and shall contain the full names and addresses of applicants, if natural persons, and in the case of firms and voluntary associations, the full names and addresses of all the members thereof, and in the case of joint-stock companies, incorporated societies, and corporations, the full names and addresses of the officers and directors thereof and under what law or laws organized or incorporated, and the place where such business is to be conducted, and such other information as the said Mayor may require. Every license granted shall date from the 1st of the month in which it is issued and expire on the 31st day of the following October, and such license shall be kept conspicuously displayed in the place of business of the licensee. Every application shall be filed not less than 30 days prior to the granting of such license, and notice of the filing of such application shall be posted in the office of the Director of the Department of Licenses, Investigation and Inspections of the said District and be published twice a week for 3 successive weeks in a daily newspaper published in the District of Columbia. Protest may be made by any person to the issuing of such license, and when such protests are filed with the said Mayor the latter shall give public notice of and hold a public hearing upon such protests before issuing such license. The said Mayor shall have the power to reject any application for license after a hearing upon such protest or for failure on the part of the applicant to observe this chapter, or when such applicant shall have violated its provisions.",
        "\u00a7 26\u2013903. Applications for license \u2014 Bond; actions thereon; use of certified copy; renewal and refiling.": "Each application shall be accompanied by a bond to the District of Columbia in the penal sum of $5,000, with 2 or more sufficient sureties, and conditioned that the obligor will not violate any law relating to such business. The execution of any such bond by a fidelity or surety company authorized by the laws of the United States to transact business therein shall be equivalent to the execution thereof by 2 sureties, and such company, if excepted to, shall justify in the manner required by law of fidelity and surety companies. If any person shall be aggrieved by the misconduct of any such licensed person, firm, voluntary association, joint-stock company, incorporated society, or corporation, or by his, their, or its violation of any law relating to such business, and shall recover a judgment therefor, such person or his personal representative or heirs or distributees may, after a return unsatisfied either in whole or in part of any execution issued upon such judgment, maintain an action in his own name upon such bond herein required in any court having jurisdiction of the amount claimed. The Mayor of the District of Columbia shall furnish to anyone applying therefor a certified copy of any such bond filed with him, upon the payment of a fee of $.25, and such certified copy shall be prima facie evidence in any court that such bond was duly executed and delivered by the person, firm, voluntary association, joint-stock company, incorporated society, or corporation whose names appear thereon. Said bond shall be renewed and refiled annually in October of each year, or the licensed person, firm, voluntary association, joint-stock company, incorporated society, or corporation shall within 30 days thereafter, cease doing business, and their license shall be revoked by the said Mayor, but said bond until renewed and refiled as aforesaid shall be and remain in full force and effect. The Mayor may waive the bonding requirements of this section, if alternative surety arrangements are secured, in cases involving parties specified in \u00a7 26-910 .",
        "\u00a7 26\u2013904. Register to be kept; contents; inspection; annual statements.": "Every person, firm, voluntary association, joint-stock company, incorporated society, or corporation conducting such business shall keep a register, approved by said Mayor, showing in English, the amount of money loaned, the date when loaned and when due, the person to whom loaned, the property or thing named as security for the loan, where the same is located and in whose possession, the amount of interest, all fees, commissions, charges, and renewals charged, under whatever name. Such register shall be open for inspection to the said Mayor, his officers and agents, on every day, except Sundays and legal holidays, between the hours of 9:00 in the forenoon and 5:00 in the afternoon. Every such person, firm, voluntary association, joint-stock company, incorporated society, or corporation conducting such business shall, on or before the 20th day of January of each year, make to the said Mayor an annual statement in the form of a trial balance of its books on the 31st day of December in each year, specifying the different kinds of its liabilities and the different kinds of its assets, stating the amount of each, together with such other information as may be called for.",
        "\u00a7 26\u2013905. Maximum rate of interest; fees and charges covered; deduction from principal prohibited; statement and receipts furnished borrower; amount of loans; violations.": "No such person, firm, voluntary association, joint-stock company, incorporated society, or corporation shall charge or receive a greater rate of interest upon any loan made by him or it that exceeds the lawful rate in the District of Columbia set by Chapter 33 of Title 28 on the actual amount of the loan, and this charge shall cover all fees, expenses, demands, and services of every character, including notarial and recording fees and charges, except upon the foreclosure of the security. The foregoing interest shall not be deducted from the principal of loan when same is made. Every such person, firm, voluntary association, joint-stock company, incorporated society, or corporation conducting such business shall furnish the borrower a written, typewritten, or printed statement at the time the loan is made, showing, in English, in clear and distinct terms, the amount of the loan, the date when loaned and when due, the person to whom the loan is made, the name of the lender, the amount of interest charged, and the lender shall give the borrower a plain and complete receipt for all payments made on account of the loan at the time such payments are made. No such loan greater than $200 shall be made to any 1 person; provided, that any person contracting, directly or indirectly, for, or receiving a greater rate of interest than that fixed in this chapter, shall forfeit all interest so contracted for or received; and in addition thereto shall forfeit to the borrower a sum of money, to be deducted from the amount due for principal, equal to one-fourth of the principal sum; and provided further, that any person in the employ of the government who shall loan money in violation of the provisions of this chapter shall forfeit his office or position, and be removed from the same.",
        "\u00a7 26\u2013906. Complaints; investigation; suspension, revocation, or denial of license.": "Any complaint against a licensee or applicant shall be made in writing to the Mayor and the Mayor, on the basis of a written complaint or his or her initiative, may conduct an investigation. Pursuant to the investigation, the Mayor may suspend, revoke, or deny a license to any applicant or licensee who violates the provisions of this chapter. Before suspending, revoking, or denying a license, the Mayor shall notify the applicant or licensee of his or her right to a hearing pursuant to \u00a7 2-509 .",
        "\u00a7 26\u2013907. Violations.": "(a) A person violating any provision of this chapter shall, upon conviction, be fined $300, imprisoned for not less than 30 days or more than 90 days, or both. In addition, the court may order any person violating this chapter to make restitution for the value of property illegally obtained as a result of the violation. Prosecutions for violations of this chapter or any rules issued pursuant to this chapter shall be conducted in the Superior Court of the District of Columbia by the Corporation Counsel or any of his or her assistants in the name of the District of Columbia.",
        "\u00a7 26\u2013908. Fees allowed on foreclosure.": "In any foreclosure on any loan made under this chapter no charges for attorneys\u2019 or agents\u2019 fees shall be made or collected which will exceed 10% of the amount found due in such foreclosure proceedings.",
        "\u00a7 26\u2013909. Penalty provisions in contracts prohibited.": "In any contract made in pursuance of the provisions of this chapter it shall be unlawful to incorporate any provision for liquidated or other damages as a penalty for any default or forfeiture thereunder.",
        "\u00a7 26\u2013910. Exemption of certain persons and businesses; service of process thereupon.": "(a) Nothing contained in this chapter shall be held to apply to the legitimate business of national banks, licensed bankers, licensed mortgage brokers, licensed mortgage lenders, any person exempt from licensure under \u00a7 26-1102 if the activity involves making or brokering a mortgage, trust companies, savings banks, building and loan associations, small business investment companies licensed and operating under the Small Business Investment Act of 1958, or to life insurance companies. As used in this section the term \u201clife insurance companies\u201d means and includes any life insurance company authorized to do business in the District of Columbia pursuant to Chapters 42 to 47 of Title 31 and any other life insurance company which has a valid, current license to do business as such in any state of the United States.",
        "Temporary Legislation": "Section 4 of D.C. Law 12-3 inserted \u201cany person exempt from licensure under \u00a7\u200226-1002 1981 Ed. if the activity involves making or brokering a mortgage\u201d in the first sentence in (a).",
        "References in Text": "The Small Business Investment Act of 1958, referred to in the first sentence of subsection (a) of this section, is the Act of August 21, 1958, 72 Stat. 689, Pub. L. 85-699 and is codified in various sections of Titles 12, 15, and 18 of the United States Code.",
        "\u00a7 26\u2013911. Enforcement; rules and regulations.": "The enforcement of this chapter shall be intrusted to the Mayor of the District of Columbia, and the Council of the District of Columbia is hereby authorized and empowered to make all rules and regulations necessary in its judgment for the conduct of such business and the enforcement of this chapter in addition hereto and not inconsistent herewith.",
        "\u00a7 26\u2013912. Exemption of certain loans; severability.": "(a) No provision of this chapter shall apply with respect to any loan, or to the making of any loan:"
      }
    }
  }
}