{
  "text": "\u00a7 26\u20131161.01. Definitions. | D.C. Law Library Skip to main content Toggle mobile menu Navigation D.C. Law Library Code of the District of Columbia Title 26. Banks and Other Financial Institutions. Chapter 11B. Nationwide Mortgage Licensing System Conformity. \u00a7 26\u20131161.01. Definitions. Code of the District of Columbia \u00a7 26\u20131161.01. Definitions. For the purposes of this chapter, the term: (1) \u201cApplicant\u201d means a person filing an initial or renewal application for licensure or registration under the Banking Code. (2) \u201cApplication\u201d means an initial or renewal application for licensure or registration under the Banking Code processed through the Department or its designee, such as the NMLS or any other person or third party prescribed by the Commissioner. (3) \u201cBanking Code\u201d means the statutory provisions concerning banking and financial institutions that are codified in Title 26, laws administered by the Commissioner, and rules and regulations promulgated pursuant to those statutory provisions. (4) \u201cCommissioner\u201d means the Commissioner of the Department of Insurance, Securities, and Banking. (5) \u201cConference of State Bank Supervisors\u201d or \u201cCSBS\u201d means the professional association of state officials responsible for chartering, regulating, and supervising state- chartered commercial and savings banks and state-licensed branches and agencies of foreign banks. (6) \u201cDepartment\u201d means the Department of Insurance, Securities, and Banking. (7) \u201cNationwide Mortgage Licensing System and Registry\u201d or \u201cNMLS\u201d means a mortgage licensing system developed and maintained by the Conference of State Bank Supervisors, the American Association of Residential Mortgage Regulators, or their successors, for the licensing and registration of persons engaged in state-regulated financial service industries. (8) \u201cState Regulatory Registry, LLC\u201d or \u201cSRR\u201d means the entity that owns and operates the NMLS, or its successor. (9) \u201cUnique identifier\u201d means a number or other identifier assigned through protocols established by the NMLS. ( Mar. 7, 2015, D.C. Law 20-172, \u00a7 2, 61 DCR 12577 .) Emergency Legislation For temporary (90 days) addition of provisions to standardize licensing and registration application requirements using the Nationwide Mortgage Licensing System and Registry, see \u00a7\u00a7 2-12 of the Nationwide Mortgage Licensing System Conformity Congressional Review Emergency Act of 2014 (D.C. Act 20-456, Oct. 23, 2014, 61 DCR 11095, 20 STAT 4358). For temporary (90 days) addition of provisions to standardize licensing and registration application requirements using the Nationwide Mortgage Licensing System and Registry, see \u00a7\u00a7 2-12 of the Nationwide Mortgage Licensing System Conformity Second Congressional Review Emergency Act of 2014 (D.C. Act 20-583, Jan. 13, 2015, 62 DCR 1280, 21 STAT 746). Temporary Legislation For temporary (225 days) addition of provisions to standardize licensing and registration application requirements using the Nationwide Mortgage Licensing System and Registry, see \u00a7\u00a7 2-12 of the Nationwide Mortgage Licensing System Conformity Temporary Amendment Act of 2014 (D.C. Law 20-146, Dec. 17, 2014,  61 DCR 8063, 20 STAT 4137). Previous Chapter 11B. Nationwide Mortgage Licensing System Conformity. Next \u00a7 26\u20131161.02. Unique identifier required. The codes and laws on this website are in the public domain. Please do not scrape. Instead, bulk download the HTML or XML . Powered by the non-profit Open Law Library . \u00a7 26\u20131161.02. Unique identifier required. | D.C. Law Library Skip to main content Toggle mobile menu Navigation D.C. Law Library Code of the District of Columbia Title 26. Banks and Other Financial Institutions. Chapter 11B. Nationwide Mortgage Licensing System Conformity. \u00a7 26\u20131161.02. Unique identifier required. Code of the District of Columbia \u00a7 26\u20131161.02. Unique identifier required. Each licensee and registrant under the Banking Code shall register with and maintain a valid unique identifier issued by the NMLS. ( Mar. 7, 2015, D.C. Law 20-172, \u00a7 3, 61 DCR 12577 .) Previous \u00a7 26\u20131161.01. Definitions. Next \u00a7 26\u20131161.03. Form and contents of application. The codes and laws on this website are in the public domain. Please do not scrape. Instead, bulk download the HTML or XML . Powered by the non-profit Open Law Library . \u00a7 26\u20131161.03. Form and contents of application. | D.C. Law Library Skip to main content Toggle mobile menu Navigation D.C. Law Library Code of the District of Columbia Title 26. Banks and Other Financial Institutions. Chapter 11B. Nationwide Mortgage Licensing System Conformity. \u00a7 26\u20131161.03. Form and contents of application. Code of the District of Columbia \u00a7 26\u20131161.03. Form and contents of application. (a) An application shall be filed on a form prescribed by the Commissioner. (b) Solely for purposes of and as needed for participating in the NMLS, the Commissioner is authorized to waive or modify by rule any requirements for applications, fees, or renewals in Chapter 1A, 3, 9, 10, or 11 of the Banking Code and to establish by rule new regulatory requirements as are reasonably necessary to participate in the NMLS. ( Mar. 7, 2015, D.C. Law 20-172, \u00a7 4, 61 DCR 12577 .) Previous \u00a7 26\u20131161.02. Unique identifier required. Next \u00a7 26\u20131161.04. Background checks. The codes and laws on this website are in the public domain. Please do not scrape. Instead, bulk download the HTML or XML . Powered by the non-profit Open Law Library . \u00a7 26\u20131161.04. Background checks. | D.C. Law Library Skip to main content Toggle mobile menu Navigation D.C. Law Library Code of the District of Columbia Title 26. Banks and Other Financial Institutions. Chapter 11B. Nationwide Mortgage Licensing System Conformity. \u00a7 26\u20131161.04. Background checks. Code of the District of Columbia \u00a7 26\u20131161.04. Background checks. The Commissioner may use the NMLS as an agent for requesting information from and distributing information to: (1) The Federal Bureau of Investigation; (2) The Department of Justice; or (3) Other law enforcement agency, regulatory agency, or credit reporting agency. ( Mar. 7, 2015, D.C. Law 20-172, \u00a7 5, 61 DCR 12577 .) Previous \u00a7 26\u20131161.03. Form and contents of application. Next \u00a7 26\u20131161.05. Confidential information. The codes and laws on this website are in the public domain. Please do not scrape. Instead, bulk download the HTML or XML . Powered by the non-profit Open Law Library . \u00a7 26\u20131161.05. Confidential information. | D.C. Law Library Skip to main content Toggle mobile menu Navigation D.C. Law Library Code of the District of Columbia Title 26. Banks and Other Financial Institutions. Chapter 11B. Nationwide Mortgage Licensing System Conformity. \u00a7 26\u20131161.05. Confidential information. Code of the District of Columbia \u00a7 26\u20131161.05. Confidential information. To assist in the performance of the Commissioner\u2019s duties under this chapter, the Commissioner may: (1) Share documents, materials, or other information, including confidential and privileged documents, materials, or information subject to this chapter, with state, federal, and international regulatory agencies and law enforcement authorities, and with the CSBS, SRR, and NMLS, or their affiliates or subsidiaries; provided, that the recipient agrees to maintain the confidentiality and privileged status of the documents, materials, or other information; (2) Receive documents, materials, or information, including confidential and privileged documents, materials, or other information, from state, federal, and international regulatory agencies or law enforcement authorities or from the CSBS, SRR, and NMLS or their affiliates or subsidiaries, and shall maintain as confidential or privileged any documents, materials, or other information received with notice or the understanding that it is confidential or privileged under the laws of the jurisdiction that is the source of the documents, materials, or other information; (3) Enter into agreements for sharing and using confidential information consistent with this chapter; (4) Authorize a national criminal background check and submission of fingerprints and other identifying information submitted through the NMLS and receive criminal history record information from the NMLS, the Metropolitan Police Department, and the Federal Bureau of Investigation for the purposes of facilitating determinations regarding eligibility for licensure or registration under the Banking Code; and (5) Contract with a third party, including the SRR, or the CSBS, or their affiliates or subsidiaries, to perform any functions, including the collection of licensing, registration, and processing fees, collection of contact information and other identifying information, fingerprints, written consent to a criminal background check, personal history and experience, and conduct of examinations-related activities covered under the Banking Code, that the Commissioner may consider appropriate. ( Mar. 7, 2015, D.C. Law 20-172, \u00a7 6, 61 DCR 12577 .) Previous \u00a7 26\u20131161.04. Background checks. Next \u00a7 26\u20131161.06. Renewal. The codes and laws on this website are in the public domain. Please do not scrape. Instead, bulk download the HTML or XML . Powered by the non-profit Open Law Library . \u00a7 26\u20131161.06. Renewal. | D.C. Law Library Skip to main content Toggle mobile menu Navigation D.C. Law Library Code of the District of Columbia Title 26. Banks and Other Financial Institutions. Chapter 11B. Nationwide Mortgage Licensing System Conformity. \u00a7 26\u20131161.06. Renewal. Code of the District of Columbia \u00a7 26\u20131161.06. Renewal. (a) A license or registration issued under this chapter shall expire on a date to be determined by the Commissioner. A license or registration may thereafter be renewed for one-year term extensions as provided by this section. (b) Before a license expires, the applicant may renew the license or registration for additional one-year terms, if the applicant: (1) Demonstrates that the applicant continues to meet the standards for licensing or registration under this chapter and under all relevant provisions of the Banking Code; (2) Pays all applicable fees as prescribed by the Commissioner and all third-party fees; and (3) Submits to the Commissioner a renewal application on the form that the Commissioner requires. ( Mar. 7, 2015, D.C. Law 20-172, \u00a7 7, 61 DCR 12577 .) Previous \u00a7 26\u20131161.05. Confidential information. Next \u00a7 26\u20131161.07. Application fees. The codes and laws on this website are in the public domain. Please do not scrape. Instead, bulk download the HTML or XML . Powered by the non-profit Open Law Library . \u00a7 26\u20131161.07. Application fees. | D.C. Law Library Skip to main content Toggle mobile menu Navigation D.C. Law Library Code of the District of Columbia Title 26. Banks and Other Financial Institutions. Chapter 11B. Nationwide Mortgage Licensing System Conformity. \u00a7 26\u20131161.07. Application fees. Code of the District of Columbia \u00a7 26\u20131161.07. Application fees. (a) When filing an application, each applicant shall pay the applicable fees prescribed by the Commissioner and any third-party fees. Any fees paid in connection with the processing of an application shall be non-refundable. (b) The Commissioner may increase or decrease the fees authorized by this section. The fees shall be fixed at such rates as may, in the judgment of the Commissioner, be necessary to defray the approximate costs of carrying out the regulatory functions set forth in this chapter and the Banking Code. These fees shall not be abated or refunded upon surrender, suspension, cancellation, or revocation of a registration. ( Mar. 7, 2015, D.C. Law 20-172, \u00a7 8, 61 DCR 12577 .) Previous \u00a7 26\u20131161.06. Renewal. Next \u00a7 26\u20131161.08. NMLS reporting requirements. The codes and laws on this website are in the public domain. Please do not scrape. Instead, bulk download the HTML or XML . Powered by the non-profit Open Law Library . \u00a7 26\u20131161.08. NMLS reporting requirements. | D.C. Law Library Skip to main content Toggle mobile menu Navigation D.C. Law Library Code of the District of Columbia Title 26. Banks and Other Financial Institutions. Chapter 11B. Nationwide Mortgage Licensing System Conformity. \u00a7 26\u20131161.08. NMLS reporting requirements. Code of the District of Columbia \u00a7 26\u20131161.08. NMLS reporting requirements. The Commissioner shall regularly report violations of the Banking Code, as well as enforcement actions and other relevant information, to the NMLS. The reports shall be subject to the provisions of \u00a7 26-1161.05 . ( Mar. 7, 2015, D.C. Law 20-172, \u00a7 9, 61 DCR 12577 .) Previous \u00a7 26\u20131161.07. Application fees. Next \u00a7 26\u20131161.09. NMLS information challenge process. The codes and laws on this website are in the public domain. Please do not scrape. Instead, bulk download the HTML or XML . Powered by the non-profit Open Law Library . \u00a7 26\u20131161.09. NMLS information challenge process. | D.C. Law Library Skip to main content Toggle mobile menu Navigation D.C. Law Library Code of the District of Columbia Title 26. Banks and Other Financial Institutions. Chapter 11B. Nationwide Mortgage Licensing System Conformity. \u00a7 26\u20131161.09. NMLS information challenge process. Code of the District of Columbia \u00a7 26\u20131161.09. NMLS information challenge process. The Commissioner shall establish by rule a process whereby applicants, licensees, and registrants may challenge information entered into the NMLS by the Commissioner. ( Mar. 7, 2015, D.C. Law 20-172, \u00a7 10, 61 DCR 12577 .) Previous \u00a7 26\u20131161.08. NMLS reporting requirements. Next \u00a7 26\u20131161.10. Authority of Commissioner to issue regulations. The codes and laws on this website are in the public domain. Please do not scrape. Instead, bulk download the HTML or XML . Powered by the non-profit Open Law Library . \u00a7 26\u20131161.10. Authority of Commissioner to issue regulations. | D.C. Law Library Skip to main content Toggle mobile menu Navigation D.C. Law Library Code of the District of Columbia Title 26. Banks and Other Financial Institutions. Chapter 11B. Nationwide Mortgage Licensing System Conformity. \u00a7 26\u20131161.10. Authority of Commissioner to issue regulations. Code of the District of Columbia \u00a7 26\u20131161.10. Authority of Commissioner to issue regulations. The Commissioner, pursuant to subchapter I of Chapter 5 of Title 2 [ \u00a7 2-501 et seq.], may issue rules to implement the provisions of this chapter. ( Mar. 7, 2015, D.C. Law 20-172, \u00a7 11, 61 DCR 12577 .) Previous \u00a7 26\u20131161.09. NMLS information challenge process. Next \u00a7 26\u20131161.11. Sunset. The codes and laws on this website are in the public domain. Please do not scrape. Instead, bulk download the HTML or XML . Powered by the non-profit Open Law Library . \u00a7 26\u20131161.11. Sunset. | D.C. Law Library Skip to main content Toggle mobile menu Navigation D.C. Law Library Code of the District of Columbia Title 26. Banks and Other Financial Institutions. Chapter 11B. Nationwide Mortgage Licensing System Conformity. \u00a7 26\u20131161.11. Sunset. Code of the District of Columbia \u00a7 26\u20131161.11. Sunset. Section 26-1161.03(b)   shall expire 2 years after March 7, 2015. ( Mar. 7, 2015, D.C. Law 20-172, \u00a7 12, 61 DCR 12577 .) Previous \u00a7 26\u20131161.10. Authority of Commissioner to issue regulations. Next Chapter 12. Savings and Loan Acquisition. The codes and laws on this website are in the public domain. Please do not scrape. Instead, bulk download the HTML or XML . Powered by the non-profit Open Law Library .",
  "metadata": {
    "site_url": "https://code.dccouncil.gov/us/dc/council/code/titles/26/chapters/11B",
    "extra_data": {
      "code_title": "Title 26: Banks and Other Financial Institutions",
      "chapter_number": "11B",
      "separated_text": {
        "\u00a7 26\u20131161.01. Definitions.": "For the purposes of this chapter, the term:",
        "Emergency Legislation": "For temporary (90 days) addition of provisions to standardize licensing and registration application requirements using the Nationwide Mortgage Licensing System and Registry, see \u00a7\u00a7 2-12 of the Nationwide Mortgage Licensing System Conformity Congressional Review Emergency Act of 2014 (D.C. Act 20-456, Oct. 23, 2014, 61 DCR 11095, 20 STAT 4358).",
        "Temporary Legislation": "For temporary (225 days) addition of provisions to standardize licensing and registration application requirements using the Nationwide Mortgage Licensing System and Registry, see \u00a7\u00a7 2-12 of the Nationwide Mortgage Licensing System Conformity Temporary Amendment Act of 2014 (D.C. Law 20-146, Dec. 17, 2014,  61 DCR 8063, 20 STAT 4137).",
        "\u00a7 26\u20131161.02. Unique identifier required.": "Each licensee and registrant under the Banking Code shall register with and maintain a valid unique identifier issued by the NMLS.",
        "\u00a7 26\u20131161.03. Form and contents of application.": "(a) An application shall be filed on a form prescribed by the Commissioner. (b) Solely for purposes of and as needed for participating in the NMLS, the Commissioner is authorized to waive or modify by rule any requirements for applications, fees, or renewals in Chapter 1A, 3, 9, 10, or 11 of the Banking Code and to establish by rule new regulatory requirements as are reasonably necessary to participate in the NMLS.",
        "\u00a7 26\u20131161.04. Background checks.": "The Commissioner may use the NMLS as an agent for requesting information from and distributing information to:",
        "\u00a7 26\u20131161.05. Confidential information.": "To assist in the performance of the Commissioner\u2019s duties under this chapter, the Commissioner may:",
        "\u00a7 26\u20131161.06. Renewal.": "(a) A license or registration issued under this chapter shall expire on a date to be determined by the Commissioner. A license or registration may thereafter be renewed for one-year term extensions as provided by this section.",
        "\u00a7 26\u20131161.07. Application fees.": "(a) When filing an application, each applicant shall pay the applicable fees prescribed by the Commissioner and any third-party fees. Any fees paid in connection with the processing of an application shall be non-refundable.",
        "\u00a7 26\u20131161.08. NMLS reporting requirements.": "The Commissioner shall regularly report violations of the Banking Code, as well as enforcement actions and other relevant information, to the NMLS. The reports shall be subject to the provisions of \u00a7 26-1161.05 .",
        "\u00a7 26\u20131161.09. NMLS information challenge process.": "The Commissioner shall establish by rule a process whereby applicants, licensees, and registrants may challenge information entered into the NMLS by the Commissioner.",
        "\u00a7 26\u20131161.10. Authority of Commissioner to issue regulations.": "The Commissioner, pursuant to subchapter I of Chapter 5 of Title 2 [ \u00a7 2-501 et seq.], may issue rules to implement the provisions of this chapter.",
        "\u00a7 26\u20131161.11. Sunset.": "Section 26-1161.03(b)   shall expire 2 years after March 7, 2015."
      }
    }
  }
}